366	Under my proposal, it's the biggest tax cut by far, of any candidate by far.	5773	Says his plan would cut taxes without increasing the deficit.	CLEAN_HARD
375	Remember this, we're the highest taxed nation in the world.	5450	Right now were the highest taxed country in the world.	CLEAN
375	Remember this, we're the highest taxed nation in the world.	6024	Were the most highly taxed nation in the world.	CLEAN
395	Our businesses pay more taxes than any businesses in the world.	7335	The United States has "the highest corporate tax rate in the free world."	CLEAN
394	We're the highest taxed nation in the world.	5450	Right now were the highest taxed country in the world.	CLEAN
394	We're the highest taxed nation in the world.	6024	Were the most highly taxed nation in the world.	CLEAN
