1801	He said I was in favor of Libya?	5364	Says Ted Cruz"said I was in favor in Libya. I never discussed that subject."	CLEAN
1172	And what was amazing in that exchange that was missing is for decades Donald has been advocating socialized medicine.	5361	A couple of debates ago, (Donald Trump) said if you dont support socialized health care, youre heartless.	CLEAN_HARD
1173	What he's said is government should pay for everyone's health care, and in fact, a couple of debates ago, he said, if you don't support socialized health care, you're heartless.	5361	A couple of debates ago, (Donald Trump) said if you dont support socialized health care, youre heartless.	CLEAN
120	As far as coming back in, number one, you wouldn't even be talking, and you wouldn't have asked that as the first question if it weren't for me when my opening when I talked about illegals immigration.	5365	If it werent for me  (illegal immigration) wouldnt even be a big subject.	PART_OF
121	It wouldn't even be a big subject.	5365	If it werent for me  (illegal immigration) wouldnt even be a big subject.	PART_OF
962	When they passed Obamacare they put a bailout fund in Obamacare.	5363	When they passed Obamacare, they put a bailout fund in Obamacare.  We led the effort and wiped out that bailout fund.	CLEAN
963	All these lobbyists you keep talking about, they put a bailout fund in the law that would allow public money to be used, taxpayer money, to bail out companies when they lost money.	5363	When they passed Obamacare, they put a bailout fund in Obamacare.  We led the effort and wiped out that bailout fund.	PART_OF
964	And, we led the effort and wiped out that bailout fund.	5363	When they passed Obamacare, they put a bailout fund in Obamacare.  We led the effort and wiped out that bailout fund.	PART_OF
